{"format":"feedseek-model-feed","version":1,"source_key":"palantir","title":"Palantir","feed_url":"https://raw.githubusercontent.com/trvny/feedseek/main/feeds/feed_palantir.model.json","source_feed":"https://raw.githubusercontent.com/trvny/feedseek/main/feeds/feed_palantir.json","home_page_url":"https://www.palantir.com/newsroom/","description":"Palantir newsroom, blog, media coverage, press releases, Foundry announcements, and release notes.","items":[{"id":"tag:trvny.github.io,2024:feedseek/palantir/b1c33bb7d4be34f0","title":"Foundry Worker data ingest and export, media ingest, and Iceberg extract operations are available without compute costs","text":"Foundry Worker is the recommended method for accessing external systems and replaces the legacy Agent Worker. From August 2026 on, Foundry Worker no longer incurs compute costs for data ingest and export, media ingest, and Iceberg extract operations. This is intended to facilitate migration from Agent Worker to Foundry Worker. What's included The following operations on Foundry Worker are now free of compute charges: Data ingest Data export Media ingest Iceberg extract Previously, these operatio","text_kind":"content","url":"https://www.palantir.com/docs/foundry/announcements#2026-10-16-foundry-worker-data-ingest-and-export-media-ingest-and-iceberg-extract-operation","date_published":"2026-10-16T00:00:00Z","date_modified":"2026-10-16T00:00:00Z","authors":["Foundry Announcements"],"tags":["Foundry Announcements"],"image":"https://palantir.com/docs/resources/homepage/iso-grid.png"},{"id":"tag:trvny.github.io,2024:feedseek/palantir/23b06e4e1788e126","title":"Developer Console now supports Global Branching","text":"Developer Console now supports Global Branching . You can develop, test, and review Ontology SDK (OSDK) React application changes alongside Ontology changes on the same global branch, validating them together before merging into main . What you can do on a global branch Generate branched SDKs: Add or remove SDK resources and generate a TypeScript SDK from the Ontology definitions on your branch. Test with branch data: Read data and run actions on the branch from a local development server or a F","text_kind":"content","url":"https://www.palantir.com/docs/foundry/announcements#2026-10-15-developer-console-now-supports-global-branching","date_published":"2026-10-15T00:00:00Z","date_modified":"2026-10-15T00:00:00Z","authors":["Foundry Announcements"],"tags":["Foundry Announcements"],"image":"https://palantir.com/docs/resources/homepage/iso-grid.png"},{"id":"tag:trvny.github.io,2024:feedseek/palantir/e36a59c126c91959","title":"View state break causes directly in Pipeline Builder","text":"Pipeline Builder's deploy menu now shows exactly which changes caused a state break for streaming and incremental pipelines, taking the guesswork out of understanding what’s blocking your deployment. Previously, the Errors tab in the deploy menu only indicated that breaking changes existed. Now, the deploy menu surfaces the reasons for unacknowledged state breaks, giving you the context you need to decide what to do next. Updated deploy menu that shows state break reasons for a streaming pipelin","text_kind":"content","url":"https://www.palantir.com/docs/foundry/announcements#2026-10-15-view-state-break-causes-directly-in-pipeline-builder","date_published":"2026-10-15T00:00:00Z","date_modified":"2026-10-15T00:00:00Z","authors":["Foundry Announcements"],"tags":["Foundry Announcements"],"image":"https://palantir.com/docs/resources/homepage/iso-grid.png"},{"id":"tag:trvny.github.io,2024:feedseek/palantir/d5acc53ca104cb14","title":"Gemini 4 Argon from Google Vertex AI now available in AIP","text":"Gemini 4 Argon from Google Vertex AI is now available as an experimental model in AIP. Model overview Gemini 4 Argon ↗ is Google's latest model, great for complex reasoning and coding tasks. Availability Gemini 4 Argon is available through Google Vertex AI on the following enrollments: Commercial: Non-georestricted, US georestricted, and EU georestricted enrollments. US Government: IL2, IL4, and IL5 enrollments. Getting started To use this model: Confirm that your enrollment administrator has en","text_kind":"content","url":"https://www.palantir.com/docs/foundry/announcements#2026-10-15-gemini-4-argon-from-google-vertex-ai-now-available-in-aip","date_published":"2026-10-15T00:00:00Z","date_modified":"2026-10-15T00:00:00Z","authors":["Foundry Announcements"],"tags":["Foundry Announcements"],"image":"https://palantir.com/docs/resources/homepage/iso-grid.png"},{"id":"tag:trvny.github.io,2024:feedseek/palantir/80235eaa8361bc39","title":"GPT-6.1 Sol now available in AIP","text":"OpenAI’s GPT-6.1 Sol is now available in AIP through Direct OpenAI, Azure OpenAI, and Amazon Bedrock for eligible commercial enrollments. For more information about the model, see OpenAI’s model documentation ↗ . Availability The following table describes availability by provider: Getting started To use this model: Confirm that your enrollment administrator has enabled the relevant model family. Review token costs and pricing . See the complete list of models available in AIP . Your feedback mat","text_kind":"content","url":"https://www.palantir.com/docs/foundry/announcements#2026-10-15-gpt-6-1-sol-now-available-in-aip","date_published":"2026-10-15T00:00:00Z","date_modified":"2026-10-15T00:00:00Z","authors":["Foundry Announcements"],"tags":["Foundry Announcements"],"image":"https://palantir.com/docs/resources/homepage/iso-grid.png"},{"id":"tag:trvny.github.io,2024:feedseek/palantir/d3443a567c855acc","title":"Claude Haiku 5.5 now available in AIP","text":"Anthropic’s Claude Haiku 5.5 is now available in AIP for eligible commercial enrollments and US government enrollments at IL2 and IL4. Model overview Claude Haiku 5.5 is designed for fast responses and high-volume workloads, including summarization, classification, and focused coding tasks. For more information, review Anthropic’s model announcement ↗ . Availability Claude Haiku 5.5 is available for eligible commercial enrollments that enable Claude through: Anthropic direct Google Vertex AI AWS","text_kind":"content","url":"https://www.palantir.com/docs/foundry/announcements#2026-10-15-claude-haiku-5-5-now-available-in-aip","date_published":"2026-10-15T00:00:00Z","date_modified":"2026-10-15T00:00:00Z","authors":["Foundry Announcements"],"tags":["Foundry Announcements"],"image":"https://palantir.com/docs/resources/homepage/iso-grid.png"},{"id":"tag:trvny.github.io,2024:feedseek/palantir/f63a1d212ef4415c","title":"GLM-5.3 now available in AIP through Amazon Bedrock","text":"Z.ai’s GLM-5.3 is available as an experimental model in AIP through Amazon Bedrock for non-georestricted and US-georestricted commercial enrollments. GLM-5.3 is an open-weight reasoning model designed for complex software engineering and multi-step agent tasks. It supports tool calling, structured outputs, and streaming responses. Learn more in the Amazon Bedrock model documentation ↗ . Getting started To use this model: Confirm that your enrollment administrator has enabled the Z.ai model famil","text_kind":"content","url":"https://www.palantir.com/docs/foundry/announcements#2026-10-15-glm-5-3-now-available-in-aip-through-amazon-bedrock","date_published":"2026-10-15T00:00:00Z","date_modified":"2026-10-15T00:00:00Z","authors":["Foundry Announcements"],"tags":["Foundry Announcements"],"image":"https://palantir.com/docs/resources/homepage/iso-grid.png"},{"id":"tag:trvny.github.io,2024:feedseek/palantir/6d0bf02f970e3743","title":"TypeScript v2 and Python functions now support Global Branching","text":"Global branching is now generally available for TypeScript v2 and Python functions. Import branched Ontology entities into your code and test your code changes on branched data with live preview within the repository. Releasing on a branch publishes Functions that are isolated to the branch, which can be tested in downstream Workshop modules, Action Types, and more. Get started in VS Code Workspaces or Code Repositories by migrating your repository to a local Ontology SDK . Use VS Code Workspace","text_kind":"content","url":"https://www.palantir.com/docs/foundry/announcements#2026-10-13-typescript-v2-and-python-functions-now-support-global-branching","date_published":"2026-10-13T00:00:00Z","date_modified":"2026-10-13T00:00:00Z","authors":["Foundry Announcements"],"tags":["Foundry Announcements"],"image":"https://palantir.com/docs/resources/homepage/iso-grid.png"},{"id":"tag:trvny.github.io,2024:feedseek/palantir/206e1edbc199ec75","title":"Control LLM data access with markings in AIP","text":"Administrators can now control LLM data access by configuring an allowlist of approved markings in Control Panel. AIP will block any LLM request from a Foundry session with access to a mandatory marking outside of that allowlist. This applies to all AIP usage, including agents such as AI FDE. Users whose access goes beyond the allowlist can still use AIP by choosing a scoped session that fits the model's policy, if available. What's new In Control Panel > AIP settings > Data access , administrat","text_kind":"content","url":"https://www.palantir.com/docs/foundry/announcements#2026-10-12-control-llm-data-access-with-markings-in-aip","date_published":"2026-10-12T00:00:00Z","date_modified":"2026-10-12T00:00:00Z","authors":["Foundry Announcements"],"tags":["Foundry Announcements"],"image":"https://palantir.com/docs/resources/homepage/iso-grid.png"},{"id":"tag:trvny.github.io,2024:feedseek/palantir/5b22248bf47a5f89","title":"Use ontology interfaces in Workshop","text":"Support for ontology interfaces in Workshop is now generally available and enabled by default across enrollments. This enables you to build Workshop applications against interface properties and links shared by multiple object types without configuring the same workflow separately for every implementing object type. Workflows enabled by interface support